title_id,title,subreddit
12yh2pp,Anyone know any good coding software for beginner?,SteamDeck
12ygz0s,Need help understanding SD software when it comes to the various docks,SteamDeck
12ygv03,What does this mean?,SteamDeck
12ygivw,Steam Deck / WIFI AND Battery problems,SteamDeck
12yggq7,64GB Back In Stock UK,SteamDeck
12ypoc3,How many people have had stick drift,SteamDeck
12yfvvy,None sSteam games stopped working,SteamDeck
12yp19s,Do i upgrade my steam 64GB internal SSD to 1gb or the external SD,SteamDeck
12yfttp,"""Run on epic gamestore"" Heroic Games Error",SteamDeck
12xgldo,Linux kernel 6.3 is out now here's some quick highlights,SteamDeck
12yr4yi,Controlling robot using Steam Deck 😁,SteamDeck
12y2mtb,Is anyone playing Shadows of Doubt on the Deck?,SteamDeck
12yez68,How good is the Deck as a daily driver PC?,SteamDeck
12xycfr,SSD Toshiba Kioxia 512G BG5 PCIE M.2 2230 okay for SteamDeck?,SteamDeck
12yejib,SteamDeck partitions and Casefolding,SteamDeck
12xp92w,Pure Data on Steam Deck ,SteamDeck
12yefhx,AMD's Unannounced Chips to Power Upcoming Handhelds Competing with Steam Deck,SteamDeck
12z8o0f,"Sold my steamdeck, made a ‘steambook’",SteamDeck
12ye2pj,My brand new Elite Series 2 keeps disconnecting,SteamDeck
12ydfxr,Having trouble applying controller layouts to a game,SteamDeck
12xypi9,Star Wars Battlefront 2 not launching,SteamDeck
12yctqp,"RCT3 game sound is bitty, anyone ever had this issue and how to fix?",SteamDeck
12yks4e,Will installing Windows 10 on SDcard break Steam OS on NVME?,SteamDeck
12y0nqk,MGS4 in Deck,SteamDeck
12yhb6n,Partitioning my SSD on my windows to install in my Deck,SteamDeck
12y1yuw,Has Elden Ring gotten worse lately?,SteamDeck
12yc9hs,Adding multiple tags to a game?,SteamDeck
12yc7or,Co-Op with 2 controllers?,SteamDeck
12xp6a2,How to view community layout text?,SteamDeck
12yc1rg,Steam deck Valheim frames very low 6-9fps,SteamDeck
12ybp3b,Shadow Tactics is SD Verified & On Sale!,SteamDeck
12yg14r,Should I put my steam deck updates on auto? I’m had to go to desktop to see there was an update,SteamDeck
12ybdpe,Need help with moonlight host setup,SteamDeck
12yolck,I’m on the train home after multiple beers…,SteamDeck
12yaz4g,Do I need a 1440p monitor to upscale my steam deck while docked?,SteamDeck
12yvxu4,Steam Deck 30fps feels gross compared to Switch 30fps,SteamDeck
12xlwlk,Linux and Steam Deck compatibility tool Luxtorpeda gets upgraded in v63,SteamDeck
12yapul,Which proton version will work for Sinbad: Legend of the Seven Seas 2003 (Windows),SteamDeck
12yapb5,Quick question,SteamDeck
12y4hwe,Connectivity issue with Monitor,SteamDeck
12y9neq,Cant get my borderlands pre sequel saves on steam deck,SteamDeck
12xf8z8,3D Printed ridged rear button pads,SteamDeck
12yfr7e,Steam deck is in stock for the UK!,SteamDeck
12xz8qv,Decky Deck,SteamDeck
12y88dn,Atelier Sophie 2 Loading Freeze,SteamDeck
12y8604,Red dead 1 how to get it to run/look better,SteamDeck
12y7w6y,Assassin's creed odyssey crash,SteamDeck
12y2a9k,Boomer's guide to ProtonTricks,SteamDeck
12ymmu2,unique accessory. Remote-controlled fire complex,SteamDeck
12yc8k5,cobblemon on steamdeck,SteamDeck
12y7glj,Reset to original Steam Deck Desktop Configuration,SteamDeck
12wurnz,My thumb turned black from the Jsaux thumb grips LOL,SteamDeck
12y754b,Need help with new keyboard mapping,SteamDeck
12wnjoa,This note saved me 67gb of download bandwidth. I love finding these tiny QOL changes that really help the SD experience,SteamDeck
12y6s6l,Parser Emudeck,SteamDeck
12w5gys,Anybody else NOT tinkering with their Deck and using it?,SteamDeck
12y6j1n,Will this charger work with my Steam Deck?,SteamDeck
12y6gjr,Best Wireless Keyboard/Mouse Combo Thing for Navigation on TV,SteamDeck
12y6cuo,jedi academy??,SteamDeck
12y62mp,Games I can play while watching tv?,SteamDeck
12y5vv9,how do i get my game data on my steam deck?,SteamDeck
12xqyxr,"I've used tools to move shader caches and compatdata to sd cards, have no games installed on the internal storage, but my 64GB deck still has 40GB of 'other' that I have no control over or ability to identify. What is going on? How can I fix this?",SteamDeck
12y5pbh,GTA V pc,SteamDeck
12y5m5b,Black screen/ extremely dim steam deck screen,SteamDeck
12yges4,How do I turn this off,SteamDeck
12xgs70,The search for a realxed MMO,SteamDeck
12y5c9k,Vortex Nexus,SteamDeck
12y57up,EA Launcher Broken Again,SteamDeck
12y54yz,"Dead Island 2 - anyone got it working, if so whats your setup?",SteamDeck
12y51d8,How to enable on screen keyboard with custom keyboard shortcut on windows 11?,SteamDeck
12xywgq,Cloud Sync between PC and Deck not working,SteamDeck
12y4wxs,Steam deck purchase and shipping,SteamDeck
12xuqib,Morrowind and Oblivion controller support?,SteamDeck
12y9vwu,Would this work on the Steam Deck to mount a phone for media etc. or anyone has a better product?,SteamDeck
12xakwg,Why does my steam deck always keep prompting authentication is required to mount?,SteamDeck
12y4pmn,Steam deck wont start,SteamDeck
12y9kp9,How can I get GTA5 Script hook V dot net working on steam deck,SteamDeck
12yc4be,Android device as Steam Deck controller?,SteamDeck
12y45ea,Hollow knight modding help,SteamDeck
12y3tbh,Windows support natively ?,SteamDeck
12yg75e,ATTENTION UK INDIVIDUALS!,SteamDeck
12y3ppu,Anyone having trouble getting ps2 games to work w emudeck?,SteamDeck
12y3l23,Problems with tf2 mic,SteamDeck
12y3gn9,Emudeck not showing up in steam os,SteamDeck
12vrbip,It do be like that,SteamDeck
12wxoj2,The hype for the Steam Deck was such a surreal experience.,SteamDeck
12y30sd,Issue getting GeoForceNOW running,SteamDeck
12y2wf5,GPU Maxing at 200mhz and CPU maxing at 40hz,SteamDeck
12y2u70,Ps3 games settings on rpcs3,SteamDeck
12y2oxe,Any applications to enable full side by side 3D to be used with the Nreal Air AR glasses on Linux? Only seen half SBS with Depth3D.,SteamDeck
12wyh9t,Check this cable if your controls are not working after SSD upgrade.,SteamDeck
12xw2fk,Good travel bag with space for extras,SteamDeck
12y7yo9,Full body Skins,SteamDeck
12y2e1p,CEMU/BotW not recognizing controller input,SteamDeck
12wa0yk,Best Way to Connect Steam Decks without a Wifi / Mobile Hotspot,SteamDeck
12y28y3,I need some help with getting osu! to run at higher than 60fps in game mode while docked,SteamDeck
12y28qp,Black screen mid game?,SteamDeck
12yam31,Is there a way to use your steam deck as a controller,SteamDeck
12y21q5,Flathub download path,SteamDeck
12xva9g,VibrantDeck isn't working anymore. Any ideas?,SteamDeck
12y1qrc,Steam deck Flying charges issue,SteamDeck
12y1790,Wow addons and Curseforge,SteamDeck
12y0wpg,Did Battle.net stop working recently?,SteamDeck
12xglwu,M.2 Cloning?,SteamDeck
12y0q3b,Is the dock horribly inconsistent or am I doing something wrong?,SteamDeck
12vwo3c,"Probably the ""sickness"" of most of the people in this group, including me.",SteamDeck
12y97t8,Any front cover that works without a back cover? Either on retail or 3D print models.,SteamDeck
12y09r8,Display disconnecting during certain in game events when playing No Man's Sky (and some other games),SteamDeck
12y05x2,Cemu BotW FPS cap weirdness,SteamDeck
12y0376,Extension cord on the Isaiah to controller. Has anyone run into trouble doing this?,SteamDeck
12xzbyj,Paper Mario 64 running through RetroArch/Emudeck. It's working but the screen is very distracting with issues. Anyone know how to fix this?,SteamDeck
12xzbj7,Trouble connecting to internet while in desktop mode.,SteamDeck
12xz6tp,Faster Speeds On Wired Connection,SteamDeck
12xz5yv,Primehack Question Related to Swapping Visors in Prime 2,SteamDeck
12xscm0,Dragon age origins,SteamDeck
12yekc3,Time for some peak chi-fi online multiplayer.,SteamDeck
12xgc8s,Portable Monitor for Steam Deck - Resolution still 1280x720.,SteamDeck
12xyva8,Is it normal for the b button on the steam deck to get stuck some times,SteamDeck
12xyfhc,CEMU freeze and can't find rom,SteamDeck
12xycb7,Template for buttons?,SteamDeck
12xy8ym,Switch and SD owners: Have you found a dock that is compatible with both?,SteamDeck
12xy4mk,Razer huntsman mini analog on Steam deck,SteamDeck
12xy30r,Hades doesn't show saves from gaming mode when played in desktop,SteamDeck
12xr4a0,help after successful overclock,SteamDeck
12xqri9,Games on Desktop,SteamDeck
12xxivj,Is is possible to move a game installed by a launcher to a different drive without redownloading?,SteamDeck
12xxi6h,Ds emulator.,SteamDeck
12xxg5j,Resident evil remastered HD on windows 11?,SteamDeck
12xqhjr,Some dumb fun shooter recommendations.,SteamDeck
12xx4oa,How to fix my aim?,SteamDeck
12xx4mm,Frame pacing issues on Citra emulator steam deck?,SteamDeck
12xx0aj,Help with steam deck,SteamDeck
12xq40n,Any way to filter library by delisted?,SteamDeck
12xwfzg,Steam deck KDE Connect version?,SteamDeck
12xvzfh,Does reimaging the steam deck remove all traces of refind/boot loader scripts?,SteamDeck
12xvxt3,Fortinet SSLVPN/Forticlient VPN on steamdeck?,SteamDeck
12xvopn,Can’t get Titanfall 2 to launch on steamdeck.,SteamDeck
12xvg3l,Low budget twoplayar games perfecto for steam deck,SteamDeck
12xveo1,Dual Booting using an external hard drive.,SteamDeck
12xv734,Enlarged image in desctop mode,SteamDeck
12y1pu4,Havent seen anyone talk specifcally about the Jsuax Mod Case Power Kit??,SteamDeck
12y1m2m,Capture Card keeps going black with OBS on Steam Deck,SteamDeck
12xuxb9,Invert Y when trigger is pulled,SteamDeck
12xuvv8,Plug-in for EmuDeck hot keys.,SteamDeck
12xuu3p,Boosting CPU usage,SteamDeck
12xuris,Yuzu flatpak vs yuzu emudeck HELP (steam deck),SteamDeck
12xunjp,Virtual keyboard cancellations,SteamDeck
12y17ww,Original Xbox emulation,SteamDeck
12ybrr9,3ds or steamdeck,SteamDeck
12xnz5y,Does opening the Steam Deck really mess with it's structural integrity?,SteamDeck
12xuhmh,Anyone run into data loss when transferring games to SD card?,SteamDeck
12xudg3,Add games purchased elsewhere to steam deck library?,SteamDeck
12xuay9,Anyone know how to force a lower than 800p resolution on halo infinite?,SteamDeck
12xtu1z,Shadows of Doubt compatibility,SteamDeck
12xtpp1,So I bought these for my Steam Deck…,SteamDeck
12y09hz,Unreal Engine 5 on SD?,SteamDeck
12xthac,Before I do a factory reset….,SteamDeck
12y8zxs,Trying to play a fan game on Steamdeck and it’s not opening.,SteamDeck
12xtdeh,MMORPG like Ragnarok Online that works on Steam Deck (with controller support)?,SteamDeck
12xtajc,My Steam Deck always turns on like this from shutdown. Any clue how to disable it?,SteamDeck
12y02ly,Options to get an a steam deck?,SteamDeck
12xt1nt,Won’t charge after changing SSD,SteamDeck
12xl9od,Killswitch Adapter(s)?,SteamDeck
12xsu8z,Have they fixed cloud saves using Epic?,SteamDeck
12xsk4j,"Frustrated with my Deck, is the 64GB EMMC to blame?",SteamDeck
12y52y8,Switching to a Steam Deck? Help me decide!,SteamDeck
12xz2o7,RMA advice from anyone who’s been through it.,SteamDeck
12xsaji,Non-Steam game not installed,SteamDeck
12xsahs,GTA V mods,SteamDeck
12xs9si,NEED HELP WITH STEAM DECK,SteamDeck
12y4zqc,64gb version is worth it?,SteamDeck
12xs5t9,"Avoiding speedy mouse cursor in menus with high trackpad sensitivity, is this possible?",SteamDeck
12xs570,Black screen when trying to boot linux from usb stick,SteamDeck
12xyvk9,Scratch on steam deck screen Any ideas how to remove it or buff it out?,SteamDeck
12xrqpl,"Mesa version showing ""outdated""",SteamDeck
12xroji,Help Concerning Controller Layouts,SteamDeck
12xdsxu,Anybody else that can't get Ubisoft Connect to work at all?,SteamDeck
12xxqia,You are only allowed to have 1 third-party accessory for the rest of your life. What do you pick and why?,SteamDeck
12xqt2z,is there a way to favorite a file folder,SteamDeck
12xqsey,Windows/Linux on one Deck,SteamDeck
12xpr68,Is heroic or separate launchers better?,SteamDeck
12xpnv4,"Question with obs, steamdeck and iPhone",SteamDeck
12xwdgn,Trying to play Elden Ring: white screen. What should I do?,SteamDeck
12xpez1,Minecraft prism launcher,SteamDeck
12xoye7,"Both windows and steamos disappeared in bootmanager, steam.cfl has disappeared as well, how can I fix this?",SteamDeck
12xbklr,MX Keys - swapping between devices. Anyone have experience?,SteamDeck
12xonja,Need controller help,SteamDeck
12xonab,Anyone know how to access the micro SD in the Deck while using SSH on Windows??,SteamDeck
12xek7j,Why can't I use the microphone of the bluetooth headsets?,SteamDeck
12xo7s6,Voice chat?,SteamDeck
12xo6bt,Proton GE app won't launch browser based Login,SteamDeck
12xo663,Xbox Controller not pairing,SteamDeck
12x7miu,How to make SteamDeck's desktop mode *actually* usable.,SteamDeck
12xni3s,Any “Playable” Extraction Looter Shooters ?,SteamDeck
12xner8,Ori and the Blind Forest: Definitive Edition - How to copy save files from one steam account to another on the same steam deck?,SteamDeck
12wm3mp,"Temp comparisons between stock SD, PTM 7950 only, and PTM 7950 with JSAUX Transparent Backplate.",SteamDeck
12xtog1,Next fun thing,SteamDeck
12xm2ip,Please help. Every time I click into the “launch options” text box in properties my deck just freezes and no inputs work. ,SteamDeck
12xlamb,EmuDeck cannot mount appimage,SteamDeck
12xsvvc,Valorant and Vanguard.,SteamDeck
