title_id,title,subreddit
12zrtqe,Honkai Star Rail can't be played on SteamOS due to Anti-Cheat,SteamDeck
130ky1c,Right Bumper is loose and wiggles,SteamDeck
1307oaj,Any single player game like training grounds in Rainbow six siege?,SteamDeck
1305khf,Multiple Versions of Proton and Linux Runtime?,SteamDeck
1307ege,Best controllers for Steam Deck,SteamDeck
1309tw1,Red Dead Redemption 2 - No way to play offline?,SteamDeck
130dlh5,Couple issues with the deck,SteamDeck
130dj5f,Sonic Generations Direct3d11 mod still required?,SteamDeck
130dg7l,Game Launchers / Proton Question,SteamDeck
130d370,Has anyone managed to install Authy on the Steam Deck?,SteamDeck
1305t6c,Deck Accessory Help... or maybe even request?,SteamDeck
13089qg,Xenia Emudeck assertion failed,SteamDeck
1303725,Does the Refresh Rate Limiter add input delay?,SteamDeck
130rzgh,Star Wars The Force Unleashed on SD,SteamDeck
1302xf7,Vampire Survivors Suddenly Stuck At 0% Downloading. Help?,SteamDeck
130cdts,Anyone here able to use Animation Changer plugin (Decky)?,SteamDeck
130cb10,Chiaki PS4 remote play hardware decode settings,SteamDeck
12zqil3,Is there a way to change the images for collections?,SteamDeck
12yiy5h,Chilling im the last english lesson before the finals. I brought the SteamDeck while my mate took His old monitor with him. We calmed our nerves with some GC-games and Tekken 7. Greetings from Germany.,SteamDeck
130bklw,After SD card swap steam deck ‘uninstalls’ games,SteamDeck
1303ne3,help with rufus and installing SteamOS,SteamDeck
130jao5,Xbox controller won’t work for Star Wars Force Unleashed,SteamDeck
12zpggz,"Rwfus tips/fixes for Tailscale, tmux, etc.",SteamDeck
13038nn,Cyberpunk in-game screenshots,SteamDeck
130ezmd,Pcsx2 no hack tab,SteamDeck
130amfh,Battery Health 6%,SteamDeck
12zrljt,Recently got my SD and having a tough time with.,SteamDeck
12yu7u7,Found the perfect art for EmulationStation!,SteamDeck
12z0z5i,Returnal on the Deck has gotten so much better since it first released,SteamDeck
12zs7tt,Issue with brand new deck,SteamDeck
130e24q,Steam deck the last of us vram glitch,SteamDeck
1301pkj,Having difficulties running Red Dead Redemption 2,SteamDeck
1309e4h,Steam Deck Won't Boot,SteamDeck
130dncr,Skate 3 Rpcs3 settings???,SteamDeck
13099za,New Deck won’t finish startup update,SteamDeck
13095g1,Omega Strikers not launching,SteamDeck
130927q,"I'm curious. If you were forced to remove either the trackpads or the back grip buttons from the Steam Deck, which one would you choose to remove?",SteamDeck
1308rg6,Halo MCC crashes to main menu,SteamDeck
1308m44,For halo mcc keeps freezing here on start up what should I do? Nothing works it just gets frozen but the music still plays,SteamDeck
1303j5l,Issues with Wonderlands Redux,SteamDeck
130on4i,My experience with the Steam Deck has been the physical manifestation of Murphy's Law.,SteamDeck
13087xq,Does steam deck always have to Compile shaders all the time?,SteamDeck
1307t4m,Need help finding next game,SteamDeck
1307ljk,New update to Steam Deck broke RE4 performance,SteamDeck
1307lbs,How to format sd with windows 11,SteamDeck
130ed9j,cant sprint in Skyrim,SteamDeck
1307bjk,Is there any reason NOT to move all the Emudeck stuff to my SD card?,SteamDeck
130780s,stadia controller,SteamDeck
1306k42,Coin OPS Legends 3 Multii Controller,SteamDeck
13065fa,"Evil Dead launches with Experimental but am met with a ""service is unavailable"" message.",SteamDeck
130dc1g,Audio popping and static in various games (mostly RetroArch),SteamDeck
1305uln,Help,SteamDeck
130eqic,Can someone tell me how long max it take for the pending payment to go thru I only use steam wallet,SteamDeck
1305tuo,"Valve support telling me this is ""within spec"". Is it?",SteamDeck
1305rib,Chiaki - internet connection port forwarding,SteamDeck
1305hlc,How do I uninstall a game soundtrack that I installed separately from the game?,SteamDeck
12zi5vq,Street Fighter 6 Demo?,SteamDeck
1305bdp,How does WoW classic Work play docked in 1080p?,SteamDeck
13053do,Has anyone gotten stalker anomaly (EFP specifically) running on the deck?,SteamDeck
130logy,Refund Policy,SteamDeck
12zqg2m,Changing System Time,SteamDeck
1304n5l,Can I connect my new official dock to my computer/monitor and stream to my friends?,SteamDeck
130f2z0,Question,SteamDeck
1304h59,(Quick Help) my non-steam game ain’t saving? HeroicGameLauncher>Manhunt2,SteamDeck
1304h36,Accessory help sought. I bought the wrong stuff.,SteamDeck
12ytiag,Everything Reminds me of her,SteamDeck
130enhv,RMA stuck on “The delivery date will be provided as soon as possible.” Is this bad?,SteamDeck
130ireo,How do you feel about this?,SteamDeck
1308xjd,Street Fighter 5 resolution issue on steam deck,SteamDeck
12zs2g5,Achievements not popping up for anyone else?,SteamDeck
12zg9de,64GB model is available in the UK again.,SteamDeck
1303t47,Switch Pro controller works at the Os level but not in game.,SteamDeck
1303swo,Advice on how to view videos on dolphin files,SteamDeck
130x1qw,Why I sold my Deck,SteamDeck
12zdepf,For the players playing any EA games right now.,SteamDeck
130heuu,Competitor to competitor to competitor,SteamDeck
13033r7,Steam Deck in Japan as a tourist,SteamDeck
13083at,Is it worth?,SteamDeck
13031hr,Why doesn't my right trackpad work anymore?,SteamDeck
12yc6u1,Sunshine on steam deck with moonlight on Vita!,SteamDeck
1302rm5,Anyone try Street Fighter 6 Demo on SD,SteamDeck
12zg493,Elden Ring on deck vs base Xbox one,SteamDeck
1302lrb,Software update keeps going back to 0%,SteamDeck
1302dkr,Ori WOTW Won’t Launch,SteamDeck
12yq4nl,"Grounded is now Steam Deck Verified! Also, Grounded will be hosting a free weekend on Steam from April 27th through May 1st.",SteamDeck
1301gkq,Multitasking bug?,SteamDeck
13015ep,Skyrim vampire modding on steam deck…,SteamDeck
1301454,"Question for those with Blood West on their Steam Deck regarding saves, moving to Chapter 2 and crashes",SteamDeck
130eddz,Sony please give me a PC port so i can finally play this on the go!,SteamDeck
1308z8l,"Looking for game suggestions, I am looking for suggestions for 2 types of games, 1) single player rpg with lots of character customization (skills/armor etc) and 2) resource/survival games like Satisfactory/Subnautica.",SteamDeck
1300pc6,Cant download Grounded,SteamDeck
12yjcdg,AMD announces Ryzen Z1 and Z1 Extreme chips for handheld gaming PCs - The Verge,SteamDeck
12yp5l9,"Xbox's Grounded gets huge 1.2 update, adds full Steam Deck verification.",SteamDeck
1305kwl,Emudeck wont mount my partitioned 1tb microsd please help SteamOS/linux gods,SteamDeck
12zzxyx,Spinning logo on game startup,SteamDeck
12ytpi5,Bluey | Styled Steam Deck logo,SteamDeck
12zz0yy,Steamdeck OS install via SD Card,SteamDeck
12zyky1,Help?,SteamDeck
13072qb,Steam Launch options won't work on Far Cry 2.,SteamDeck
12zyg4k,Dual Monitor Support on Steam Dock Broken?,SteamDeck
1303uuw,For Honor on Windows 10,SteamDeck
12zy6xo,Guys has ANYONE gotten the wired dualsense connection to work with sackboy?,SteamDeck
12zy3wj,"GTA san andreas ""cannot find 800x600x32 video mode""",SteamDeck
12zy2kt,XBox Cloud Gaming won't use Steam Deck Controls,SteamDeck
12zxzr2,locating minecraft world file and how to download on steam deck.,SteamDeck
12zxypm,RDR2 Crashes when going into hunting mode,SteamDeck
12zxyc3,Traveling with the deck. Case suggestions?,SteamDeck
12zxtmz,Half Life: Opposing Force seems to have an odd vibration when you control the camera?,SteamDeck
130gemq,Wtf is this,SteamDeck
12zneql,Installing Battle.Net,SteamDeck
12zxr2p,Do I have to do anything to change my micro sd card for the Steam Deck?,SteamDeck
130gxfs,Seems like a dig at Asus if you ask me,SteamDeck
12zx6ul,Since when MK10 is not available on SteamDeck?,SteamDeck
130htox,Dear Valve. please let us cap battery loading to 80%,SteamDeck
12z3s1t,MechCommander on Deck!,SteamDeck
12zwl8g,SD Card Games are missing?,SteamDeck
12zwfn5,I cant get borderlands 3 to work,SteamDeck
12zvkit,Getting this error when trying to launch emudeck,SteamDeck
12zvi07,Steamdeck controller isn't worker,SteamDeck
1302fhn,Minecraft is a little fuzzy. (monitor or steam deck?),SteamDeck
12zusnc,"Playing remotely on steamdeck connect, how to quit and return to pc without closing session",SteamDeck
13078lr,"Mobile port, but the best shooter I've played on Deck.",SteamDeck
130537d,OK. I’m stupid. I want to launch the game on my PC and use the AWESOME Steamdeck as my controller.,SteamDeck
12ztpwp,Issue on steamdeck,SteamDeck
12ztk04,Help me please: how to partition my micro SD between Windows and Steam OS?,SteamDeck
12zgcdb,Tetris Effect: Connected with AR glasses,SteamDeck
1301nnt,new steam deck. setup problems,SteamDeck
12zt8wt,Newbie questions,SteamDeck
1306pmb,POKEMON HOME,SteamDeck
12zsnot,Is my right track pad faulty?,SteamDeck
12ymra7,[Deckmate] Cablemate release (FINALLY!) and business updates!,SteamDeck
12zsksi,Chiaki4Deck,SteamDeck
13049a0,Help with opening decky,SteamDeck
12zse1y,Got a fun little idea to improve my deck experience for minimal to no cost. Unsure how to go about it.,SteamDeck
12zs75x,Steamdeck Custom ABXY Buttons,SteamDeck
12zs4er,"Looking At The Steam Deck As An Emulator, But Concerned It Is Too Much For A Newbie",SteamDeck
12yf1tj,Improved AMD Color Management Being Worked On For The Steam Deck,SteamDeck
12zs27z,Mass Effect Andromeda/EA Launcher not working again,SteamDeck
12zitnf,Steam Deck wont turn on after shutting down,SteamDeck
12zrwfj,"Unable to play, verify files, or uninstall Vermintide 2—any ideas?",SteamDeck
12zrvfd,Anyone have success with the SF6 demo on the deck?,SteamDeck
12z12jf,Canadians without an internal Steam Deck upgrade already,SteamDeck
12yrf79,Finally got Butcher Bay working!,SteamDeck
1300hm0,Anybody had issues with the scotch tape method to fix stuck b-button?,SteamDeck
1305nxq,"Heard a rattle and did a tear down, should I care that I lost this clip?",SteamDeck
12zri73,Division 2 Controls Stop Working,SteamDeck
12z59q6,Assassins Creed Unity on Steam Deck,SteamDeck
13000pg,"Can’t get past beginning loading screen for madden 12 on my steam deck, running on rpcs3 ps3 emulator, any help/tips?",SteamDeck
12zqqpw,Steam deck storage options,SteamDeck
1302fv3,Bayonetta 2 crashes on a remembrance of time chapter.,SteamDeck
130estl,The ASUS ROG Ally is a serious Steam Deck rival,SteamDeck
1303yah,How hard could it be to buy a second hand steam deck in Japan?,SteamDeck
12zoa6p,Connecting Portable Display,SteamDeck
12znu5v,Read dead isnt loading past rockstar loading screen,SteamDeck
12zfk7b,Can't use entire screen in non-steam program?,SteamDeck
12zmp0l,Any tips on removing the JSAUX back plate?,SteamDeck
12zwqty,"""Boomer Shooters"" recommendations",SteamDeck
12zm7uz,Ubisoft Connect - Nothing Surprises Me Anymore,SteamDeck
12zwgkb,"The Sony DS4 controller seems to be a favorite, any opinions or compatibility issues with the DS5 controller?",SteamDeck
12zw94w,"I know there are like a million threads on this, but....",SteamDeck
12zw83d,Wii Import save not working does anyone know how to fix this?,SteamDeck
12zl5za,Resident evil 2 Remake blurry?,SteamDeck
12zl56l,Does anyones else’s steam deck screen freeze while in game?,SteamDeck
12zl1w1,UK Steam Deck owners,SteamDeck
12zkxdw,Repurpose ssd?,SteamDeck
12z7v5j,What are the steps to play EA games?,SteamDeck
12zknsg,Internal Keyboard Question,SteamDeck
12zuzy1,I'm so Sad. Sent off my deck for RMA and got it back today still Broken.,SteamDeck
12zzgpc,"Alright alright, I'm finally ready to get to emulation.",SteamDeck
12yvym0,"I’m thoroughly prepared for this game to not work this week when it comes out, but it’s worth a shot and I’ll just exchange it for credit if I have to I guess.",SteamDeck
12zjjww,ME2 no sound,SteamDeck
12zdo5t,How to find where a non steam game is,SteamDeck
12zjbur,Deep Rock Galactic SteamOS server list doesnt show,SteamDeck
12zjap9,Has anyone completed Star Ocean The Last Hope on Deck?,SteamDeck
12zj9b1,April 2023 - EA Stand Alone (Non-Steam Game) Broken Again? Here we go ...,SteamDeck
12yzezz,Is this the real reason for the compartment?,SteamDeck
12z38km,BEST LOCAL MULTIPLAYER GAMES FOR LONG BUS/CAR RIDES,SteamDeck
12ziili,SSD WD SN740 1To or Samsung PM991A 1To ?,SteamDeck
12yy0u4,Steam Servers,SteamDeck
12zhwrc,Heroic game launcher keeps disconnecting my epic account,SteamDeck
12zwy5e,"Modding EGS titles installed with Heroic (Gungeon, specifically?)",SteamDeck
12zhvr0,Tale of two wastelands not working,SteamDeck
12zhv7b,What is this error (highlighted in yellow),SteamDeck
12ygm0l,The EA Launcher is the worst of the lot,SteamDeck
12zhqci,Cemu not detecting Nintendo Pro Controller,SteamDeck
12zhgls,Steam Deck Overclock for Windows 11,SteamDeck
12zbvy0,Moving a non steam game from pc to deck?,SteamDeck
12zuoq8,This console can run It still with no compatibility?,SteamDeck
12zgmz5,Dark Souls Remastered,SteamDeck
12z7d7s,Marvel Midnights Suns Graphics Settings Resetting,SteamDeck
12zgfbv,"Hi, When I try to play far cry 3 it's showing this error. I already have ubisoft connect installed and assassin's creed black flag in my deck running good. please help.",SteamDeck
12zg9g0,How to make Pcsx2 Run beter on steam deck emudeck,SteamDeck
12zg3y3,Civilization VI docked mode?,SteamDeck
12zf98r,Faulty Steam Deck,SteamDeck
12yyspd,Playing Resident Evil 4 Original w/HD Project Mod,SteamDeck
12z3bry,Division 1 and 2,SteamDeck
12ymqw4,Small issue with the steam deck...,SteamDeck
12zddd8,Horizon Zero Dawn crashing,SteamDeck
12yowgm,I figured out how to install plugins,SteamDeck
12zd5uf,Did anyone figuire out how to fix the stuttering in Just Cause 3?,SteamDeck
12zd36r,Logitech G933 Headset Microphone not picking up any noise,SteamDeck
12zczy4,Using Lutris,SteamDeck
12zcxr4,Save Files Vanished,SteamDeck
12znhjf,Need For Speed: Heat,SteamDeck
12z2938,I’ve put over 20 hours in on Rdr2 on my Deck with no problems. Rockstar launcher decided to stop working today. Any advice?,SteamDeck
12zcq1p,I really wish CDPR would let us roll back to 4.01 on The Witcher 3...... 4.02 is much worse imo,SteamDeck
12zqxnd,I just got my deck... I think it's already dead...,SteamDeck
12zhqwd,Upgrading Storage to 1TB,SteamDeck
12yd096,GTA IV on steam deck is brilliant,SteamDeck
12zcent,Unable to launch Rocket League on Heroic Launcher.,SteamDeck
12zqroc,Here's an article on that SteamDeck-controlled gun...,SteamDeck
12zccdz,How to see the .local files and others like that on wine/proton file viewer?,SteamDeck
12zbrvx,Can you uninstall shaders with developer mode on?,SteamDeck
1307qox,I don’t know guys. I guess I’m struggling to justify my Steam Deck purchase.,SteamDeck
12zbhdy,Happy SteamDOCK users: how are you dealing with unclear wake/sleep statuses.,SteamDeck
1303cyy,What makes the ASUS Rog better than the Steam Deck?,SteamDeck
12zonbk,SSD battle: Which should I install?,SteamDeck
12z6x4c,"Gave the newest build of Project 06 a run and it runs well, but....",SteamDeck
12zsns1,Afraid to unbox my 2 tb ssd from aliexpress. Mailman delivered the package being at least 3x times bigger than the mailbox opening,SteamDeck
12zazke,Any recommendations for VERY (and I mean VERY VERY VERY) easy games for the deck? Preferrably 2d and couch co-op,SteamDeck
12yrt0t,I remixed / 3D printed some dock adapters to fit larger cases! (Mumba Blade Series is mine.),SteamDeck
12zawzk,Inputs are messed up after hitting home button.,SteamDeck
12zavoe,External game launcher showing not enough space,SteamDeck
12z3im4,Trying to figure out what’s taking up “other” space,SteamDeck
12zalpn,Black screen,SteamDeck
12zal41,"Power on straight to boot menu without holding VolumeDown+Power, and/or entering the boot menu/BIOS wirelessly?",SteamDeck
12zl8fw,What are these and can I delete them?,SteamDeck
12zaf6v,"Discord - Screensharing audio issue solved, but video is now an issue",SteamDeck
12za24s,Can Pixelmon or cobblemon work on the Deck,SteamDeck
12z9rck,How to erase image from Deck?,SteamDeck
12z9pmh,RPCS3 freezes when I try to do anything with it on my Steam Deck,SteamDeck
12yy44f,Help With NFS Underground On Steam Deck,SteamDeck
12z49x8,After a year conclusion is Windows on a A2 SD card any good / worth it?,SteamDeck
12zif0o,I seem to be running into some issues on my deck,SteamDeck
12z8p3g,install unsupported but working game from steam - not listed in library?,SteamDeck
12yv4d2,Inland 2230 1tb m.2,SteamDeck
12z3ppo,Does anyone know if Zool Redimensioned is playable on the deck?,SteamDeck
12yjy63,Metal Gear Solid HD Collection,SteamDeck
12z7ks3,Save file transfers,SteamDeck
12yxda0,Is it possible to use Bluetooth controller within Steam Desktop mode?,SteamDeck
12zblhp,To those who have played GTA 4 on the Deck - how is it?,SteamDeck
12yx33r,Dolphin Controllers,SteamDeck
12z6wjn,Has anyone experience with RTS Games on the SteamDeck ?,SteamDeck
12zfbp3,Considering getting a steamdeck but I'm still not entirely familiar with it. Can anyone help out and give advice?,SteamDeck
12z18be,You can't play two games at once?,SteamDeck
12z5ztk,This ssd attempted upgrade is getting to me,SteamDeck
12z5yzo,Tried to re-image from sd card and not working,SteamDeck
12z5xti,What controller are you using with your Steam Deck for multiplayer games?,SteamDeck
12yxe5q,Help please,SteamDeck
12ykrhm,64GB in and out of stock,SteamDeck
12z0gyf,Fixing PCSX2 Control Issues,SteamDeck
12z0aqx,Stardew Valley Steam Deck Control Help,SteamDeck
12z4wpw,Do folks update the ARCH Linux or let SteamOS decide when to do that?,SteamDeck
12z4wcj,Installing Windows on microSD,SteamDeck
12z4skb,desktop mode issue,SteamDeck
12zbrub,Need an advice on slim travel cover/case,SteamDeck
12yfgid,Mapping analog stick input to backbuttons no longer working April 2023,SteamDeck
12z4iwf,Sandisk HighEndurance SD Card - An in use review,SteamDeck
12z8uyk,No space available. Help?,SteamDeck
12zia7h,Lord forgive me for what I'm about to play,SteamDeck
12zam9o,Having Problem Ordering Steam Deck,SteamDeck
12zc1rd,Can’t open Epic games games.,SteamDeck
12z2zwe,Didn’t know so easy,SteamDeck
12xt0ea,Steam deck ram mount set up!,SteamDeck
12z2ta2,Question,SteamDeck
12zitfk,Steam Deck vs ROG Ally,SteamDeck
12z2ea7,steam rom manager,SteamDeck
12z24rd,Update Problem,SteamDeck
12ympec,Getting old (and not so old) disc pc games onto Steamdeck?,SteamDeck
12ymij9,How do I get past the read me on Aliens Vs Predator,SteamDeck
12z1sqw,Destiny 2,SteamDeck
12xdow5,What games are ABSOLUTELY perfect for the SteamDeck?,SteamDeck
12ypo45,Modding Skyrim on the steam deck,SteamDeck
12zas4e,Street Fighter 6 demo 60FPS on SteamDeck,SteamDeck
12z90mm,"So after months of saving, I just ordered my SteamDeck!",SteamDeck
12z17ex,Non-steam game crashes after adding artwork,SteamDeck
12zylle,SteamOS still sucks.,SteamDeck
12yidq9,Good games to pick up and play for 10 minutes?,SteamDeck
12z0jus,My 64GB Steam Deck dont read the SD Cards,SteamDeck
12z5hfb,Need help playing Silent Hill 4:The Room,SteamDeck
12z058p,Switching from Docked (w/ controller) to Handheld (Advice needed),SteamDeck
12yztnv,Has Mafia 3 been fixed on the Steam deck?,SteamDeck
12y4co5,What upcoming games are you going to be playing on your Deck?,SteamDeck
12yzgws,Gamie loading problem,SteamDeck
12yzbvd,Steam directory,SteamDeck
12yz9as,Tetris screen resolution,SteamDeck
12ymstf,Help my game keep lagging in cutscenes,SteamDeck
12yswjb,3.4.6 causing wake issues,SteamDeck
12ym7zu,Recommendation of good local co-op/split-screen games for 2-4 players (any system),SteamDeck
12yy7et,Sun haven?,SteamDeck
12z7yar,$600 usd for 64gb,SteamDeck
12yxxq0,Any help for a super New Steamdeck user,SteamDeck
12yxnbb,Metal Gear Solid: Twin Snakes disc change,SteamDeck
12yx7p1,This is on sale for $25 in store. Would it allow me to use keyboard/mouse & controller on my deck?,SteamDeck
12xpsqd,Valve moves ELDEN RING back to Proton 7 as it has issues with newer Proton,SteamDeck
12ywgsp,Peakdo Steamdeck Mod,SteamDeck
12ywfxf,Gloomhaven handheld mode?,SteamDeck
12ymg8i,Steam community please help me out.,SteamDeck
12yw9th,ea won't work,SteamDeck
12z6bdu,A cool steam deck game,SteamDeck
12yvbim,The value behind the Steam Deck,SteamDeck
12xfto9,Has the Steam Deck changed your purchasing habits on Steam?,SteamDeck
12yuy5v,Mods are dope,SteamDeck
12yikp1,Who here has done a screen replacement themselves? What level of skill is needed?,SteamDeck
12yucny,Charger Help!!,SteamDeck
12z9rl9,Trying to figure out how to put chatgpt into your steamdeck. Look at the results from this app,SteamDeck
12yo02o,Any advice for anti-glare?,SteamDeck
12yzxcj,gta 5 mods help,SteamDeck
12ytvbx,Issues running Assassin’s Creed Odyssey,SteamDeck
12ynibn,Multiplayer on SD,SteamDeck
12xhq34,Ok I didn’t expect that VR would work,SteamDeck
12x1l80,Steamdeck retail in stock in japan!,SteamDeck
12yzf88,What games are better on a Deck than a PC?,SteamDeck
12z2d29,Steam deck noob question: Can i install different linux distros into the Desktop mode of the deck or does it require a full wipe ? or can you self contain gaming mode and desktop mode in some way to install other linux stuff ?,SteamDeck
12z2al8,Is there anyway to get the desktop mode to actually be pleasant to use?,SteamDeck
12yt5jv,Generic controller support?,SteamDeck
12yt05f,Playing leapster games on the deck.,SteamDeck
12yt02g,Is it possible to stream GamePass games installed on my Windows PC to the SteamDeck? Not talking about xCloud streaming.,SteamDeck
12ymqg9,Weak Haptic,SteamDeck
12ysvnj,7800 games,SteamDeck
12z1wqr,How do I change the boot animation on my steam deck if it's running windows 11?,SteamDeck
12ysp1o,Charger Question,SteamDeck
12yse2a,Marvel Vs Capcom Infinite - Is it worth it? (Playing on my Steam Deck),SteamDeck
12ys9kr,Files not showing up on ‘add non-steam game’,SteamDeck
12ys2cr,PS4 Fusion Pro Conroller,SteamDeck
12yrob3,BT Controller Not Working on Gaming Mode on Steam Link or Moonlight,SteamDeck
12yrara,Aesthetic Suggestions,SteamDeck
12ykw92,Anyone know how to get Mass effect 3 working on steam deck?,SteamDeck
12yr01a,Any offline-compatible game recommendations for someone who loves MMORPGs?,SteamDeck
12yqnpr,Power Problems with USB-C External Display Turning Off and On (Blackout),SteamDeck
12yqlga,Mech Shooter,SteamDeck
12xkfo4,What emulator games are you playing on your deck?,SteamDeck
12yql6s,Some games have different save files in desktop and gaming mode and can't access each other,SteamDeck
12yqbh5,New to Deck life and have a Question,SteamDeck
12yq8ur,Can a cheap USB dock damage my Steam Deck?,SteamDeck
12yzs6i,Moving to Alaska,SteamDeck
12xam0b,Anyone else just adding things and not using them?,SteamDeck
12ypvj4,Quick questions:,SteamDeck
12yzhdh,Reminder to change this setting for better performance in some cases!,SteamDeck
12xfwbf,HDR and Colour Management patches for Steam Deck + AMD GPUs under review,SteamDeck
12ypt1v,Configuring Chiaki for PS4,SteamDeck
12ypqwc,Editing HLTB,SteamDeck
12yjibg,Poor Dota 2 performance while docked,SteamDeck
12ypo21,"Trash Error, cant delete file :(",SteamDeck
12ypmz0,Anyone know how to clear up blurry text in Fallout new vegas?,SteamDeck
12z1btc,"""Minimum battery life"" is a terrible metric for PC handhelds and we should stop discussing it",SteamDeck
12ypf7x,Immortals: Fenyx Rising on Deck vs. PS4?,SteamDeck
12ypcb9,Healing for WoW on Steam Deck,SteamDeck
12yp39r,Docking station,SteamDeck
12xskkj,A look at some of the best games you can get under $10 in the 'Steam Puzzle Fest' sale,SteamDeck
12yovnt,Will the Deck run Ableton 10?,SteamDeck
12youpc,Did anyone get Identity V to work on the steam deck?,SteamDeck
12yuqih,Installing Overwatch 2 and other games on my SD card,SteamDeck
12yofkg,Can't connect to steam store?,SteamDeck
12z2zjx,So does everyone just love sniffing the air blowing out of their steam decks vents??? 😂,SteamDeck
12yu29y,Other Storage,SteamDeck
12yhop1,"Hi there, this information is for those who reimaged their steamdeck directly from the sd card and found that it won't let you format it after. *Windows Only*",SteamDeck
12yhmgn,Any clean way to create a reliable button chord in steam input?,SteamDeck
12za5gb,"I made eggs in a basket this night, and after cooking it, I found out it kind of looks like the steamdeck logo",SteamDeck
12ymuu6,ROG Ally will be below 1000 dollars,SteamDeck
12z4h9m,I got a minor scratch on my left trackpad. I believe it just a plastic scratch. Can i fix it with heat gun or just leave it and apply sticker on it?,SteamDeck
12xg9gb,I wanna take a second and appreciate the case quality,SteamDeck
12ym13j,Does anyone know how to get cloud saves to work on heroic game launcher?,SteamDeck
12ylzsy,In this situation with Clonezilla. With my computers Hard drive or SSD work ? I don’t see why not but want to make sure,SteamDeck
12yzxn7,This is so frustrating,SteamDeck
12yrags,Micro SD card size,SteamDeck
12yflbi,How’s your experience with TLOU on Steam Deck?,SteamDeck
12ykwq6,Does Harmony's Odyssey work on Deck?,SteamDeck
12yusst,Can't make a purchase in rocket league 😭,SteamDeck
12yqvtd,eMMC and NVME,SteamDeck
12yke84,Ryzen Z1 series cpu for handhelds.,SteamDeck
12yjpzn,"I lost 14 hours of progress in Hollow Knight, anything I can do to save it?",SteamDeck
12yc0d5,EU options for SSD replacements,SteamDeck
12yt6w3,This is a good SSD 1To ?,SteamDeck
12yjcjf,Adding compatibility layers from Lutris to Steam,SteamDeck
12yp1fe,Any German user here ?,SteamDeck
12yhzcm,I have a question about SD card speeds with SSD vs eMMC--- *64gb vs 256*,SteamDeck
12wlr7n,Introducing the new Steam Boy!,SteamDeck
12yni9a,Where will the tech be By years end?,SteamDeck
12ycvg0,Tetris Effect: Connected doesn’t start,SteamDeck
12yhiuc,Master cheif collection set up help,SteamDeck
12yhiqb,USB or SD,SteamDeck
12ynd9q,anyone have the sandisk ultra sd card in their deck?,SteamDeck
12xt6fd,MGS:V PS4 Save to PC (Steam Deck),SteamDeck
12x97rv,Steam Deck Boot Video | Dreams Media Molecule | by : me,SteamDeck
