title_id,title,subreddit
131z2gq,"I love this kinda support, even for a 20 year old game",SteamDeck
131qh8d,"Just had my Steam Deck stolen :(, do you guys how can I report the serial number?",SteamDeck
131tc62,How is Jedi Survivor on Steam Deck?,SteamDeck
131skf6,What's your favorite game to play on the deck that no one has heard of?,SteamDeck
1322bkt,Reminder you can always stream for better performance/battery for games that don’t run well,SteamDeck
1324gwh,Aliexpress 2TB is legit!,SteamDeck
131lb16,The Evil Dead Game runs great on the steam deck btw!!!,SteamDeck
1325ac3,Stumbled upon youtube video recommending 64 GB steam deck and 2 weeks later…,SteamDeck
13187jz,Bluey | Styled Steam Deck Boot Video,SteamDeck
13199bd,I Only Play WoW on the Steam Deck and I regret nothing,SteamDeck
1322ize,"Hello again! I'm still reviewing every single franchise ever on the Steam Deck - I hope you guys find this as useful as my other videos. This week, it's Ape Escape!",SteamDeck
13228x7,Steam Deck makes an amazing desktop PC in a pinch!,SteamDeck
131kjtu,Someone forgot to lock that button 👀,SteamDeck
130jmpw,I figured out what the SteamDeck pouch is for!!!,SteamDeck
1329o22,Worse performance?,SteamDeck
131ymrb,haven't touched my steam deck in almost 2 months,SteamDeck
131ile3,Final Fantasy 7 (7th Heaven Mod) Gameplay | SteamOS | Steam Deck | UMA 4GB + Cryo 2.1,SteamDeck
13223zj,The Last Of Us Part 1 WON’T LAUNCH After Patch 1.0.4 on Steam Deck,SteamDeck
131nhtr,"For those who have purchased GuliKit Hall Joysticks for Steam Deck at AKNES store, I will provide a discount for those who want to purchase the new version (For Type A/B).",SteamDeck
1316jgr,Steam Deck just got a color vibrancy slider,SteamDeck
131w6ib,ATTN: Use Cemu 1.2.6f for BOTW - 2.0 tanks the performance,SteamDeck
131mjrl,Street Fighter 6 All Graphics Settings Gameplay | SteamOS | Steam Deck | UMA 4GB + Cryo 2.1,SteamDeck
130evw8,Asus ROG Ally will most likely be better in a lot of ways and that's ok,SteamDeck
1322z9i,Decky Loader not installing,SteamDeck
131hgyi,Jedi Survivor: any steam deck tests yet?,SteamDeck
13213in,"How to use ""steam"" key on external keyboard while in game?",SteamDeck
130ez2u,Main os update new feature!,SteamDeck
1312u7l,Am I the only one who thinks the best thing about the steam deck is the ergonomics,SteamDeck
1327g37,Xbox streaming auto logout,SteamDeck
132260v,Friendly reminder: Grounded is now deck verified and is having a free weekend right now,SteamDeck
131syww,Geekbench 6 Benchmark Results: Stock vs UV vs UV+TDP+OC,SteamDeck
131wp05,What was the most Graphically intensive game you ever played in the deck?,SteamDeck
1312ntz,Gulikit type B coming next month,SteamDeck
131vgg6,Suvivor Steam Deck,SteamDeck
130gp61,Made my own Steam Deck intro ,SteamDeck
132b92z,Dark souls is super dark,SteamDeck
132b7yu,Alcohol wipes on steam deck 512 model screen,SteamDeck
132b70t,Clean install after ssd swap,SteamDeck
130xdqy,PS3 GTA Online on Steam Deck,SteamDeck
132b4vs,This is such a little annoyance but how do you stop these icons from scrambling and layering ontop of eachother in desktop mode ?,SteamDeck
132b2v8,DOOM 2016 Not Showing Keyboard Inputs,SteamDeck
132arka,The STEAM+X Keyboard bind isn’t working? Any fixes?,SteamDeck
132airk,I know nothing about SSD cards. Is this a good option?,SteamDeck
132afpc,New update fucked my setup,SteamDeck
132adr3,Anyone know of any way to manually sort the Storage Manager external drive order?,SteamDeck
132a4ll,TURBO OVERKILL on Steam OS,SteamDeck
132a35g,Run two games side by side?,SteamDeck
1329ht5,I have a CSS loader request?,SteamDeck
1329hdf,SteamDeck status bar is missing on Reboot,SteamDeck
13223o7,To all the Breath of the wild players. Does the frame rate drop when you progress into the game?,SteamDeck
1329825,P5R hex editing for 16:10,SteamDeck
13297nq,Mode shift double trigger issue help,SteamDeck
13293iu,Redfall deck verified ?!,SteamDeck
1321ixv,Games not launching from brand new sd,SteamDeck
1328vj4,Point and click recommendations,SteamDeck
1328tly,How many Docks do you have?,SteamDeck
1328m8h,How buggy is the main channel?,SteamDeck
1328ebz,Issues logging into Epic via Heroic Games launcher?,SteamDeck
1328dp9,Any recommendations for a case for the Deck that will fit the iVolver dock?,SteamDeck
13288zt,Steam Deck Plugin for Price Charting,SteamDeck
130pzdv,"Skill Up on Twitter: I’ll have a Jedi Survivor review up later but right now I can say that it’s a great game that you should absolutely avoid if you’re playing on PC (for now, at least). The port is a total mess, namely awful FPS performance that cannot be improved through any settings changes",SteamDeck
1327tf3,Origin/EA app not working since Deck system update (Beta channel),SteamDeck
1327mel,anyway of getting xbox app to run in desktop mode? it says cant open in dos mode tho,SteamDeck
1327f6v,What’s everyones favorite AAA for the Deck in April/May,SteamDeck
1327bvh,"Label printed for five days, then cancelled.",SteamDeck
1327bh3,Games from Johren on Steam Deck?,SteamDeck
132799n,Remote play ignores SD control config and just defaults to remote Desktop Control,SteamDeck
132743v,Killswitch Travel Cover Question,SteamDeck
1326wii,Any undervolters out there? Boot hang,SteamDeck
1303lyr,BOTW running flawlessly on Latest Yuzu (Early Access). Locked to 30fps. Great news for TOTK!,SteamDeck
13269p8,Power Limits... Lol. Not for me,SteamDeck
13262sk,Have you guys seen this before?,SteamDeck
132615k,Looking to pickup either a 64/256 GB SD. How's the Shader cache situation?,SteamDeck
131ogww,FFXI on Steam Deck,SteamDeck
1325wed,R1 button feels harder,SteamDeck
1325qig,How do i fix this? Stupid launcher,SteamDeck
131uh1e,Motion Plus not working in Dolphin,SteamDeck
1325pnk,Can I play Dead Island 2 offline on Steam Deck?,SteamDeck
1325p4o,Steam Deck RMA question.,SteamDeck
1325d5a,Steam Deck accessory carrying case suggestions?,SteamDeck
1325b4g,I got Monster Hunter Frontier Fully Working with good controls on the Steam Deck (guide?),SteamDeck
1315o86,New meets classic. Is a very interesting vibe playing the Steam Deck on a Sony Trinitron CRT. Definitely recommend. Suddenly I’m nostalgic.,SteamDeck
1325at6,"Website with all verified, playable and unsupported games?",SteamDeck
132572x,Possible To Set Default Collection On Home Screen?,SteamDeck
132532s,Built In Timer?,SteamDeck
132515a,"how is this possible? Can anyone help me? I don’t have anything installed on desktop and if I do, how do I wipe desktop clean? I’m trying to install proton files",SteamDeck
131swry,Programming L stick to click and hold for sprint in Fable 3,SteamDeck
1324rdd,Menu screen blacks out on Steam Deck after installing mods. More details in the comments.,SteamDeck
132398w,Game closing as soon as I start it up,SteamDeck
130ey4m,How to get 60fps in Witcher 3,SteamDeck
131rq0l,Keyboard not working in Gaming or Desktop mode,SteamDeck
130ng2d,Corsair Unveils A Tiny And Fast SSD To Supercharge Your Steam Deck And SFF Gaming PC,SteamDeck
132185u,Tips on getting Warriors Orochi 3 to run well,SteamDeck
1320xza,USB C Hubs With PD Passthrough?,SteamDeck
130u3gw,Star Wars Jedi: Survivor appears to have major CPU and VRAM optimization issues on PC,SteamDeck
131yuh7,Is there any better option than Decky Recorder or OBS to record our footage?,SteamDeck
1306yv3,Probably the best thing in the recent Emudeck 2.1 update - cloud services!,SteamDeck
131yix2,My new steamdeck is freezing,SteamDeck
131ydsf,Need help deciding what to purchase,SteamDeck
131y8nb,Remove roms from library to many emudeck,SteamDeck
131xzh4,Prevent game/application from showing up on main menu game list?,SteamDeck
131xukk,Error checking MicroSD card,SteamDeck
13273oy,Skyrim/Oblivion Modding,SteamDeck
131wi89,Trying to do the right thing. Transfer my deadcells save from emudeck to steam so I can buy the game.,SteamDeck
131w0n6,Why can't I see cinematics on re8?,SteamDeck
131vz06,PS4 D-pad not recognized OS v3.4. 6,SteamDeck
131vxjx,What do you wish you knew before Changing out your Thumb Sticks,SteamDeck
13266fy,Jedi survivor possible performance increase,SteamDeck
1311z6r,The Last of Us gets more optimizations and another Steam Deck fix,SteamDeck
1325w5b,How do I get my steam deck ready to sell?,SteamDeck
131u3i2,I've been playing aliens fireteam for about 2 months now. All of a sudden it doesn't work,SteamDeck
131swvc,Looking for portable headset for steamdeck,SteamDeck
131nqim,vkBasalt not working with Shaders,SteamDeck
131npcx,Anyone gotten Honkai Star Rail working yet?,SteamDeck
131stru,Should it take 5 hours to download and install a 34gb game?,SteamDeck
131sth7,helpful knowledge you wished you knew before getting it?,SteamDeck
131sqeo,Download and play offline Xbox Game Pass games?,SteamDeck
131sn6b,Hello guys how can i get to this location can someone help?,SteamDeck
131egy6,Recommend touch-friendly games?,SteamDeck
131scw9,Any fix for the Nintento Pro Controller LED being constantly lit up?,SteamDeck
13082hs,House Fire Updates + Valve HW Team is Awesome + Steam Deck Can Help You If You Get Hit And Run,SteamDeck
1323eov,Is it safe to use my XPS 13 charging cable (USB-C) on the deck via an Anker hub?,SteamDeck
131rfzb,Separate Game Shortcuts for Different BOTW Settings?,SteamDeck
130v9xg,[PSA] Parsec won't support the Steam Deck. Use Alternatives!,SteamDeck
131rdez,File Recovery Software,SteamDeck
131rbee,"Seen some asking about star wars, it's not looking good.",SteamDeck
131r9rw,How to deal with constant Game Pass Ultimate Login prompts,SteamDeck
131r8qn,Greenlight (xcloud) fails to launch in game mode,SteamDeck
131r3co,"Heroic launcher - EPIC games frequent request to log in again, and can't log in anymore. Are here somoneone like me here?",SteamDeck
131qy0k,Looking for a portable controller for Steam Deck,SteamDeck
1328p77,Probably a stupid question but...,SteamDeck
131qswr,How many people using Emudeck have tweaked graphics settings in RetroArch?,SteamDeck
131qsvs,Separate Audio settings Request,SteamDeck
131qhxd,Evaluating no-brand SSD upgrade quality,SteamDeck
131qe6d,Jedi survivor steam deck stable settings (so far),SteamDeck
131q2w1,Find steam deck/sudo password,SteamDeck
131q0ig,Should I update emudeck and if so will it delete my game saves and profiles?,SteamDeck
131pz30,Emudeck - Retroarch - How can I set unique core settings for 1 game only?,SteamDeck
131po7s,Is manually adjusting TDP for less demanding games necessary?,SteamDeck
131pjn1,Left trackpad getting scorchingly hot,SteamDeck
131pdhe,Ability to install games remotely,SteamDeck
131x3kb,"With the day one patch, how does the new Jedi Survivor run on Deck?",SteamDeck
131ou5s,GRIS crashing on startup on Steam Deck,SteamDeck
131orrz,"Spelldrifter game, installed via Heroic",SteamDeck
131dvn3,Deck-to-Deck Multiplayer/Co-op?,SteamDeck
130h9vx,Proton Experimental upgraded for April 26th brings fixes and new game support,SteamDeck
131op26,What does it mean when it says “This game's anti-cheat is not configured to support Steam Deck”?,SteamDeck
130aemk,Gulikit's Type B replacement SteamDeck sticks will be a complete kit.,SteamDeck
12zjgl2,"It's Over, Fam. Time to Pack It In.",SteamDeck
131ufdd,Is undisputed working smoothly on steam deck?,SteamDeck
1310lkr,Dead Island 2,SteamDeck
131kc3m,Anti-glare screen protector on 256GB SD,SteamDeck
13199bv,is there any way of getting myself a battery overlay?,SteamDeck
131tys8,Can you ran Xbox game pass on the steam deck without Xbox cloud?,SteamDeck
131o2wk,Anyone know if Sensible World of Soccer 2020 can run on SteamOS?,SteamDeck
131npak,How do i get the Steam Deck to recognize MiniDoom2 Controls?,SteamDeck
131nl8u,Jedi Survivor performance and settings,SteamDeck
131chjv,My 30 Hour Nier Replicant Save is gone,SteamDeck
131j5ab,Bluey | Styled Steam Deck Boot Video Shortened,SteamDeck
131mujs,Right thumbstick button not working; how likely to be an easy fix?,SteamDeck
131mmxs,Steam Deck Star Wars Jedi Survivor,SteamDeck
131gbcb,Pokémon Fan Games,SteamDeck
131m8gj,Screen protector on Anti Glare?,SteamDeck
131m5wh,Installing Dock to SteamOS?,SteamDeck
131m0wx,Steam deck crashes when opening controller settings for a certain game,SteamDeck
131luav,Can the stream deck run Tabletop Simulator D&D well?,SteamDeck
131q62n,[MODDING question] modular controllers for the steam deck mod even possible?,SteamDeck
131q5y2,How to get rid of blur in Skrim ?,SteamDeck
131z024,How do I make this go away?,SteamDeck
131hqtw,Lower brightness even more?,SteamDeck
131li62,Honkai Star Rail Using Steam Deck As A Screen To Display The Game And Use The Controls While My Pc Hosts The Game.,SteamDeck
131lha8,"Classic unconnected booting problem, but there’s a catch",SteamDeck
12zn3sq,"EmuDeck 2.1 has launched, including a homebrew store, new emulators, a new design and more.",SteamDeck
131le3t,Red dead online,SteamDeck
130r63f,"Street Fighter 6 on Steam Deck and Linux tested, Valve sets it to Proton Experimental",SteamDeck
131l7q4,"SteamDeck Discover (Software Center) - Heroic Games Launcher, Proton, etc not listed. [SOLUTION]",SteamDeck
131kvmu,"Steam and power buttons not working. Games not installing, etc...",SteamDeck
131kmfx,Disable triggers / analogue haptics,SteamDeck
131kin5,Playing ps5 on steam deck?,SteamDeck
131kgwh,RE3 Modding Question,SteamDeck
131o0aw,Factory reset - new start,SteamDeck
1325rkj,Dude this is pretty cool,SteamDeck
131jnfb,Best version of Tetris to play on Steam Deck,SteamDeck
131c47x,Bypass telco hotspot to steam deck,SteamDeck
131j9iw,Ubisoft Connect Game Download,SteamDeck
131j7bb,I can't play the games I download.,SteamDeck
13296jf,What’s you take? Steam Deck or the ROG Ally?,SteamDeck
131j5ra,Death Stranding freeze after loading or after a while,SteamDeck
131eo2f,How do I update to the League 8.5-1 wine version on Steam Deck?,SteamDeck
131izg7,New Steam Deck case. What do you think?,SteamDeck
131iwgm,Is crossplay with Xbox available from STEAM OS?,SteamDeck
131i9cs,Er patcher with mods,SteamDeck
131rugg,Has anyone played Jedi survivor?,SteamDeck
131htyj,Has anyone seen a screen issue like this?,SteamDeck
131hnjm,What’s This?,SteamDeck
131hekd,Do anyone know how to fix the the division 2 form crashing?,SteamDeck
131nmqw,Which story game to play next on Deck,SteamDeck
131hag1,"SteamDeck EmuDeck update SNAFU: I added way too many roms with the parser, tried to stop it half way through, and it did, but now I got a huge pile of uncategorized/non-steam games that I can't delete except one at a time. Is there a file I can clear? The Emudeck remove list isn't working.",SteamDeck
131h7vk,Roller coaster Tycoon 2 saves,SteamDeck
131gvvu,Game download 0 bytes,SteamDeck
131gvv5,Crashing in the divison 2 on steam deck what to do?,SteamDeck
131gvp7,Read Dead 2 45 fps,SteamDeck
131kixj,PSA: Using your Steamdeck while wearing polarized sunglasses is a terrifying experience,SteamDeck
131fz66,Stutter on some GOG DosBox games when played on Deck?,SteamDeck
1304nfq,"I made a script to install all of your Non Steam Game Launchers on the Steam Deck (Epic,GOG, Battle.net,Origin and Ubisoft. Any help to get this on Decky Loader would be helpful as well as any help to add to this script to make it better.",SteamDeck
131jshf,Star Wars Jedi Survivor - The State of it,SteamDeck
131fdlu,HDMI connection issues,SteamDeck
131fcna,GTAV LSPDFR,SteamDeck
131f81r,.love files not opening through steam,SteamDeck
131lngg,Whats a good quality/price MicroSD (512gb) for Steam Deck,SteamDeck
131f19s,Playing FarCry5 and this is in the top corner. (Sorry for taking a photo of the screen),SteamDeck
131ezh0,"Might belong on the Minecraft subreddit; when I jump, my character won't stop until I hit jump again, is there anyway to make that not happen? It's frustrating;-;",SteamDeck
131ey29,Forza 4 broken again,SteamDeck
131j30t,Steam Deck Battle.net error,SteamDeck
131e7wt,Bug? Steam deck desktop mode black bar in Library,SteamDeck
131e5cq,I can't get my SD into a screensaver mode,SteamDeck
130wae7,Abandoned PC games for steam deck,SteamDeck
131meed,How do I install other official Proton versions on the Deck?,SteamDeck
1318fc0,Elden Ring on flight without internet?,SteamDeck
131dlwb,Games don't show after sleep mode,SteamDeck
131m073,Can you use hdmi in on the steam deck (to use it like a monitor)?,SteamDeck
131li10,Playing resident evil on steamdeck,SteamDeck
131cq9h,Emudeck RPCS3 Problems?,SteamDeck
131cp2g,Controller Settings,SteamDeck
131cifg,What boot up animations would you like to see?,SteamDeck
131jmux,Jedi: Survivor not working,SteamDeck
131c9m0,Is there any steam deck wizardry that could make the deck a second monitor for playing 3ds games?,SteamDeck
131c21m,What is the current version of the system ?,SteamDeck
131bzi9,"Skyrim SKSE ""Can't read arguments""",SteamDeck
131bz3k,Need help to make better,SteamDeck
131ghae,Any way to play Kingdom Hearts 1.5 Remix?,SteamDeck
131bki2,Recent system update has messed up mac payne 3!,SteamDeck
131gggy,Fall guys login every time,SteamDeck
131bcqv,FF XIV launcher password type issue,SteamDeck
131b104,Can someone tell me why Gotham Knights look so shitty on my steam deck?,SteamDeck
131fx4f,What happens if you press alt f4 in gaming mode,SteamDeck
131k3ch,How to get animal crossing on steam deck?,SteamDeck
131aqyh,Game won’t launch,SteamDeck
130f28j,Sonic World DX (fan game) running on Steam Deck.,SteamDeck
131am1d,Fans going crazy,SteamDeck
131ah5t,Non Steam Games and FSR2.0 question,SteamDeck
1312s44,My home screen is going crazy,SteamDeck
131a1i0,Is transfer pak functional?,SteamDeck
131lmux,Desktop Bricked?,SteamDeck
1319rwp,Some games don't run on new SSD.,SteamDeck
1319m9g,Star Wars battlefront 2 working?,SteamDeck
1319ixe,Can anyone help me fix this problem. Ive tried almost everything. My last option was to factory retest which I did and the problem still persist. Even switch Wi-Fi channels from 2.4gjz to 5ghz both ways and the problem still exist.,SteamDeck
1306i50,I am officially an emulation convert!,SteamDeck
130cgpt,New 2230 ssd suitable for steamdeck from corsair!,SteamDeck
1318ke1,Steam deck audio mic,SteamDeck
1318gj0,"help with mo2 mod organizer, should I change it to /home/local/ etc, or leave it as z:\home\local/etc?",SteamDeck
13188fu,Mass Effect LE offline,SteamDeck
13185c2,64GB and 256GB out of stock in the UK.,SteamDeck
131829u,How can I turn off achievements in retro arch.,SteamDeck
1317ujn,How can I update the Battle.net client?,SteamDeck
1317jao,Problems with Battle Net launcher,SteamDeck
130yub3,Fall guys (steam version) crashes to library launch page after easyanticheat screen. Advice?,SteamDeck
131fvep,New to the deck,SteamDeck
1316zs9,What are the guides to follow?,SteamDeck
1316she,"Has anyone got a raphnet adaptor to be supported in any 64 emulator? Specifically, natively as a N64 controller that doesn't need configuration, like in project64k on windows",SteamDeck
131fpiw,Fortnite,SteamDeck
1316ka3,What are the trackpads for besides desktop activities?,SteamDeck
1316d6e,Warhammer: Vermintide II no sound issue.,SteamDeck
131683n,Has anyone got cloud services like YouTube to work using Emudeck?,SteamDeck
13167hs,(For MC players) Rethinking Voxels?,SteamDeck
13165mk,Travel Charger for Japan,SteamDeck
1315xbk,Desktop freezing issue. Has anybody else run into this?,SteamDeck
130f67x,Anyone else got PCSX2 issues with previously working games now not running?,SteamDeck
1315nss,Chiaki port forwarding on Verizon fios router,SteamDeck
131570v,Game sharing not working for 1 account help,SteamDeck
1314x24,Steam deck cannot reimage,SteamDeck
1314uhz,Game will not launch,SteamDeck
131eiy0,Does anyone know if it’s possible and if so how to Download sidequest on steam deck,SteamDeck
1306t85,Chiaki is a game changer (literally) now I can play my ps5 without needing to be in the same room lol,SteamDeck
1314lhj,Skyrim modding from Bethesda.net,SteamDeck
131jk9a,I’m so lost you guys can anybody make a video with steam deck installing mods for oblivion?,SteamDeck
13141ez,"How do i fix these weird lines on the sides? (Melon DS Core ,Retroarch).",SteamDeck
1313ypl,Keep getting this message when trying to transfer game from sd card to internal drive. I have more than enough storage for it. How do I fix it,SteamDeck
131b0gy,Anyone received a deck recently?,SteamDeck
130tbbg,Post your list of Games beaten on SD so far.,SteamDeck
1313r4o,Bluetooth controller not working,SteamDeck
1313k6c,Civ VI - Finally a game where mods work on the deck!,SteamDeck
1313jue,Is the SSD 256 version faster than eMMC in OS menus ?,SteamDeck
131aot3,Is The Latest OS 3.4.6?,SteamDeck
12yt1y8,Keeping me company during chemo......,SteamDeck
131akc5,I have $56 in my Steam wallet. What should I buy?,SteamDeck
13136cu,Ghost Recon Wildlands 2023 performance?,SteamDeck
131devs,What to do with extra Steam Deck SSD?,SteamDeck
130qm9h,Just installed a 1TB NVMe in my deck and the benchmark results are pretty wild.,SteamDeck
1312bhr,Having issued with internet speeds in Discover,SteamDeck
13121sf,Nreal Air not getting a stable 60fps?,SteamDeck
130phxw,Anyone running SteamOS as their gaming PC OS?,SteamDeck
131hdtm,Which company will jump into the UMPC market next?,SteamDeck
131195q,The last case of Bénédict fox : no go ...,SteamDeck
1318xgj,Windows 11 on steam deck,SteamDeck
13112vt,ivoler dock works with stock power supply or nintendo switch power supply?,SteamDeck
13112jn,Looking for a racing game,SteamDeck
13111vs,Is there a controller layout for Konsole? (The terminal application.),SteamDeck
131c5xa,RedM roleplay servers,SteamDeck
1310xgq,Being told this bleed is normal,SteamDeck
131e66n,Help! Xenoblade Chronicles 3 Keep On Crashing In Steam Deck,SteamDeck
131bwhq,if you're going to use a screen protector buy the 64gb deck,SteamDeck
130nbo4,Possible to undervolt or overclock on steam is 3.5 yet?,SteamDeck
13183ug,Magnetic joysticks?,SteamDeck
1317z8l,nReal Air still turning off at 50% battery?,SteamDeck
130z54y,melon ds screen problem,SteamDeck
130z2os,Any good case/armor with SD Slot(s)?,SteamDeck
1317m7v,Dead Pixels Twice in a Row steam deck...,SteamDeck
130y4e8,"Steam deck stuck In ""Emergency mode""",SteamDeck
130y4dt,Corsair MP600 Mini 1 TB in Steamdeck - barely 100MBs,SteamDeck
130iqf3,Looks like the new update has blown up RE Engine games.,SteamDeck
130xl5l,Cheap SD card gets recognized in partition manager but not in game mode.,SteamDeck
1316nor,Have to RMA my deck and am trying to use Clonezilla to clone the deck. The Sd card reader/clonezilla option is missing from the Boot from menu. Any help would be amazing,SteamDeck
130w5x4,Lutris - Master Branch help,SteamDeck
1300ehc,Living the dream,SteamDeck
130vdrr,Stealth case/cover for work?,SteamDeck
130ur85,Age of Empires noob - Which one would you recommend as a great fit for my Deck?,SteamDeck
130u7tb,Help me make a choice...,SteamDeck
1314rhi,Emulationstation Desktop Edition in Windows?,SteamDeck
130sm40,Jedi Fallen order,SteamDeck
130sdma,Persona 4 Golden No Input Detection,SteamDeck
130sapl,Games not registering any controller inputs,SteamDeck
13137xn,Switch games on the SD,SteamDeck
130s7gx,Nintendo key bindings possible?,SteamDeck
130s17u,Chivalry 2 (Epic games),SteamDeck
130s06w,Mouse lag on my TV,SteamDeck
12zwq5d,RetroDECK v0.6.6b - Released!,SteamDeck
12znzdf,Games to take turns and pass the deck around,SteamDeck
130rhfu,S.T.A.L.K.E.R. Call of Chernobyl mod - SteamDeck,SteamDeck
130ra6s,About installing Windows,SteamDeck
130px8b,Do you charge to 100% or unplug it at 80%?,SteamDeck
130ptve,Is it possible to use the Steamdeck as a 2nd controller on the PS4?,SteamDeck
130pr8n,3d printed deckmate killswitch,SteamDeck
130nwha,Question about chiaki,SteamDeck
130nhij,FFXIV DLC’s,SteamDeck
130n9xw,Dead Space on SteamDeck via EA App,SteamDeck
130n0vf,emudeck 2.1 cloud services not starting,SteamDeck
130m8jj,Proton Confusion,SteamDeck
1313abr,Does Anyone Know When New Steam Deck Batches Are Made?,SteamDeck
12zddxb,Steam Deck gets a Preview update with STAR WARS Jedi: Survivor improvements,SteamDeck
130l9r8,Emudeck update problem.,SteamDeck
130l9g1,Risk of Rain 2 won't recognize inputs,SteamDeck
130l2t0,How does steam desktop mode handle games differently to game made?,SteamDeck
130kzip,Headphone Jack is Borked,SteamDeck
12zrfmo,"got GZDOOM working with deck, the customizability of Steam Input is insane.",SteamDeck
130u35d,Got my Steam Deck with a dead pixel. What can I do?,SteamDeck
130k8rx,Issues with rebooting?,SteamDeck
130k7tx,Grounded error,SteamDeck
130plrt,Can I bring my deck on the plane with a 65w battery?,SteamDeck
1300ko7,What can you guys recommend for multiplayer shooters on the SD?,SteamDeck
130i3uy,RDR2 not launching?,SteamDeck
130o4s3,Is there a quicker way to get games on Steam Deck?,SteamDeck
130uchn,LineageOS on Steam Deck?,SteamDeck
12z53w4,A startup video that's a slam dunk,SteamDeck
12zxrci,Has anyone tried one of these stations with their Deck? I've been using a third party dock for a while (with my Deck mostly in desktop mode as a PC) and I got the Dbrand case which made it too bulky for the dock. I was thinking about one of these stations so I could leave the grip on at all times.,SteamDeck
130mbfy,SD card issues after formatting with Steam Deck,SteamDeck
130snay,Kindle anyone?,SteamDeck
130s3n4,Use the deck as a pro controller for the Nintendo switch,SteamDeck
130lz9i,Loving EmuDeck. Please recommend good resources for game cards & banners.,SteamDeck
130lyf0,Am I the only one who cant play RD2?,SteamDeck
130wq2b,Steam deck pricing,SteamDeck
12ys8fb,"ok, JUST HEAR ME OUT",SteamDeck
130lq6j,any ideas on how to install microsoft store (bought)/game pass pc games?,SteamDeck
130f47w,"Hi all, new to SD, why my SD won’t connect to my mobile router? It works fine with every other Wi-Fi network I tried but my router",SteamDeck
130f34j,What are my charging options on an airplane,SteamDeck
130vbwn,Any sales in the foreseeable future?,SteamDeck
130l9j4,SD card help on what to buy?,SteamDeck
